{
  "schema_version": 1,
  "record_id": "sol-05-kriticki-01",
  "exercise_id": "ex-05-kriticki-01",
  "unit_id": "05",
  "source_anchor": {
    "path": "chapters/05-vizualizacija.qmd",
    "anchor": "ex-05-kriticki-01"
  },
  "task_class": "kriticki",
  "prompt_fingerprint": "sha256:68a76469764b4f135e24887293bff04c513deebd9050d9cbe171f4cc42611f7a",
  "answer_components": {
    "planted_error": {
      "applicable": false,
      "not_applicable_reason": "Kritički zadatak dopušta izbor različitih objavljenih grafova i traži dokazanu presudu, a ne audit jedne unaprijed posađene pogreške.",
      "error_id": null,
      "statement": null,
      "why_wrong": null
    },
    "revealing_diagnostic": {
      "applicable": true,
      "not_applicable_reason": null,
      "procedure": "Zabilježiti izvor, vrstu geometrije, dvije uspoređene vrijednosti te donju i gornju granicu prikazane osi; zatim izračunati koliki bi dio usporedive osi od nule zauzela razlika, provjeriti oznaku prekida i usporediti grafički naglasak sa zaključkom pratećega teksta.",
      "expected_evidence": "Presuda se oslanja na provjerljive vrijednosti i raspon osi. Za stupce je nulta početna točka potrebna jer duljina nosi vrijednost, dok kod linijskoga ili raspršenoga prikaza odsjecanje može biti opravdano ako je vidljivo i služi čitanju položaja, a ne pretvaranju malene promjene u veliku."
    },
    "plausible_non_answers": {
      "applicable": true,
      "not_applicable_reason": null,
      "responses": [
        {
          "response": "Svaka skraćena os automatski je obmana.",
          "why_insufficient": "Položaj na linijskom ili raspršenom prikazu može opravdano koristiti raspon podataka ako je odsjecanje jasno i zaključak ostaje razmjeran."
        },
        {
          "response": "Graf je pošten jer su sve brojke točne.",
          "why_insufficient": "Brojčana točnost ne provjerava koliko prostora razlika zauzima ni kodira li duljina vrijednost od zajedničke nule."
        },
        {
          "response": "Os je skraćena jer ne počinje od nule, pa dodatni račun nije potreban.",
          "why_insufficient": "Zadatak izričito traži izračun prostora na osi od nule kako bi presuda imala mjerljiv dokaz."
        },
        {
          "response": "Prekid je vidljivo označen, pa je odsjecanje opravdano.",
          "why_insufficient": "Oznaka otkriva zahvat, ali ne popravlja stupac čija duljina više nije razmjerna vrijednosti niti jamči da tekstualni zaključak nije pretjeran."
        }
      ]
    },
    "model_response_components": {
      "applicable": true,
      "not_applicable_reason": null,
      "components": [
        {
          "component_id": "identify-source-and-claim",
          "required_claim": "Odabrani graf, izvor, datum i tekstualna tvrdnja uz graf jasno su identificirani.",
          "required_evidence": "Provjerljiva poveznica, bibliografski podatak ili snimka koja čuva graf, osi i prateći tekst."
        },
        {
          "component_id": "name-geometry-and-axis",
          "required_claim": "Odgovor razlikuje stupce koji kodiraju vrijednost duljinom od linijskoga ili raspršenoga prikaza koji je kodira položajem.",
          "required_evidence": "Vrsta oznake, početak osi, gornja granica i eventualna oznaka prekida očitani su s grafa."
        },
        {
          "component_id": "calculate-zero-baseline-share",
          "required_claim": "Razlika između dviju imenovanih vrijednosti izražena je kao dio usporedive osi od nule.",
          "required_evidence": "Vidljiv račun s izvornim vrijednostima, razlikom i punim rasponom osi od nule do odabrane gornje granice."
        },
        {
          "component_id": "judge-visible-break",
          "required_claim": "Odgovor navodi je li odsjecanje vidljivo i objašnjava zašto sama oznaka nije dovoljna za opravdanje.",
          "required_evidence": "Provjera oznake na osi povezana je s geometrijom i usporedbom koju graf traži."
        },
        {
          "component_id": "compare-graph-and-text",
          "required_claim": "Presuda provjerava mijenja li skraćena os snagu ili smjer zaključka u tekstu uz graf.",
          "required_evidence": "Grafički naglasak uspoređen je s doslovno ili vjerno prenesenom tvrdnjom izvora."
        },
        {
          "component_id": "state-reversal-condition",
          "required_claim": "Odgovor navodi konkretan uvjet pod kojim bi presuda bila suprotna.",
          "required_evidence": "Uvjet mijenja geometriju, vidljivost odsjecanja, razmjernost zaključka ili odluku koju čitatelj treba donijeti."
        }
      ]
    },
    "numerical_check": {
      "applicable": false,
      "not_applicable_reason": "Svaki student bira drugi objavljeni graf, pa nema jedinstvenoga kanonskog broja; rubrika umjesto toga zahtijeva provjerljiv račun iz vrijednosti i osi odabranoga izvora.",
      "expected_result": null,
      "tolerance_or_acceptance_rule": null,
      "independent_method": null,
      "evidence_reference": null
    },
    "severity_ranked_rubric": {
      "severity_order": [
        "fatal",
        "major",
        "minor",
        "useful_improvement"
      ],
      "criteria": [
        {
          "criterion_id": "fatal-unverifiable-source-or-unsupported-verdict",
          "severity": "fatal",
          "description": "Graf ili njegove vrijednosti nisu provjerljivi, račun je izmišljen ili presuda ne proizlazi iz geometrije, osi i pratećega teksta.",
          "observable_evidence": "Središnji sud nije moguće reproducirati iz odabranoga objavljenog izvora."
        },
        {
          "criterion_id": "major-missing-zero-axis-break-text-or-condition",
          "severity": "major",
          "description": "Nedostaje račun za os od nule, provjera oznake prekida, usporedba s tekstualnim zaključkom ili uvjet obrnute presude.",
          "observable_evidence": "Jedan izričito traženi dokazni posao u odlomku nije obavljen."
        },
        {
          "criterion_id": "minor-imprecise-range-or-geometry",
          "severity": "minor",
          "description": "Presuda je obranjiva, ali gornja granica osi, jedinica ili razlika između duljine i položaja nije dovoljno precizno zapisana.",
          "observable_evidence": "Lokalna dopuna čini račun ili terminologiju provjerljivom bez promjene presude."
        },
        {
          "criterion_id": "useful-quantifies-displayed-exaggeration",
          "severity": "useful_improvement",
          "description": "Odgovor uspoređuje udio prostora koji razlika zauzima na prikazanoj i na nultoj osi te jasno odvaja vizualno povećanje od stvarne promjene.",
          "observable_evidence": "Dva omjera čine jačinu grafičkoga zahvata neposredno usporedivom."
        }
      ]
    }
  },
  "alternatives": [
    {
      "alternative_id": "defensible-truncated-position-plot",
      "description": "Prihvatljiva je pozitivna presuda za jasno označenu skraćenu os na linijskom ili raspršenom prikazu kada položaj, a ne duljina od nule, nosi usporedbu.",
      "acceptance_boundary": "Račun s osi od nule i usporedba s tekstualnom tvrdnjom i dalje su obvezni."
    },
    {
      "alternative_id": "conditional-verdict",
      "description": "Prihvatljiva je uvjetna presuda ako su geometrija ili vrijednosti djelomično nejasne u objavljenoj slici.",
      "acceptance_boundary": "Odgovor mora imenovati što nije provjerljivo i objasniti koji bi točno podatak promijenio presudu."
    }
  ],
  "instructor_notes": [
    "Ne ocjenjivati političku ili sadržajnu poželjnost tvrdnje. Ocjenjuje se odnos geometrije, osi, izračuna i zaključka uz graf.",
    "Zadržati dokaz odabranoga izvora u predaji. Bez osi i vrijednosti nije moguće razlikovati kritiku prikaza od dojma."
  ],
  "visibility_contract": "D06-two-layer-v1",
  "human_responsibility": {
    "judgment_owner": "student_or_submitting_author",
    "verification_required": true,
    "code_production_assessed": false
  }
}
