{
  "schema_version": 1,
  "record_id": "sol-09-konceptualni-01",
  "exercise_id": "ex-09-konceptualni-01",
  "unit_id": "09",
  "source_anchor": {
    "path": "chapters/09-procjena.qmd",
    "anchor": "ex-09-konceptualni-01"
  },
  "task_class": "konceptualni",
  "prompt_fingerprint": "sha256:cd93b4d11cc9f6202aab2438840cdd714ea1509a5f5cbe3e9e815d6dcc7e2c84",
  "answer_components": {
    "planted_error": {
      "applicable": false,
      "not_applicable_reason": "Konceptualni zadatak izravno traži ispravno razdvajanje postupka, parametra i dviju vrsta nesigurnosti; ne sadrži jednu posađenu pogrešnu analizu.",
      "error_id": null,
      "statement": null,
      "why_wrong": null
    },
    "revealing_diagnostic": {
      "applicable": true,
      "not_applicable_reason": null,
      "procedure": "U dvije kolone razvrstati uzorak i granice nasuprot populacijskom parametru, a zatim odvojeno pitati što bi se promijenilo ponovnim uzorkovanjem gotovih oznaka i što bi se promijenilo novim pravilom kodiranja.",
      "expected_evidence": "Uzorak i interval slučajni su prije opažanja, parametar je fiksan, a 95 % opisuje dugoročni obuhvat postupka. Bootstrap gotovih oznaka mijenja sastav tekstova, ali drži pravilo kodiranja fiksnim, pa ne uključuje nesigurnost toga pravila."
    },
    "plausible_non_answers": {
      "applicable": true,
      "not_applicable_reason": null,
      "responses": [
        {
          "response": "Parametar je slučajan jer ga ne poznajemo.",
          "why_insufficient": "Nepoznatost nije isto što i slučajnost u ovom frekventističkom postupku. Populacijski parametar ostaje fiksan kroz ponavljanja."
        },
        {
          "response": "Razina od 95 % znači da je 95 % opažanja unutar intervala.",
          "why_insufficient": "Obuhvat se odnosi na udio intervala koji hvataju parametar, a ne na pojedinačna opažanja."
        },
        {
          "response": "Bootstrap uključuje nesigurnost kodiranja jer u svakom ponavljanju bira druge retke.",
          "why_insufficient": "Izbor drugih već označenih redaka ne mijenja pravilo po kojem su oznake nastale."
        }
      ]
    },
    "model_response_components": {
      "applicable": true,
      "not_applicable_reason": null,
      "components": [
        {
          "component_id": "identify-random-objects",
          "required_claim": "Slučajni su uzorak i interval koji bi novi uzorak proizveo.",
          "required_evidence": "Kroz ponovljena uzorkovanja mijenjaju se opažanja, procjena i granice."
        },
        {
          "component_id": "identify-fixed-parameter",
          "required_claim": "Populacijski parametar ostaje fiksan kroz sva ponavljanja.",
          "required_evidence": "Isti cilj uspoređuje se sa svakim novim intervalom."
        },
        {
          "component_id": "interpret-confidence-procedure",
          "required_claim": "Razina pouzdanosti opisuje dugoročni udio intervala postupka koji obuhvaćaju parametar.",
          "required_evidence": "Nakon opažanja granica pojedini interval parametar obuhvaća ili ne obuhvaća."
        },
        {
          "component_id": "separate-coding-uncertainty",
          "required_claim": "Bootstrap gotovih oznaka ne obuhvaća nesigurnost pravila kodiranja.",
          "required_evidence": "Ponovno uzorkovanje mijenja zastupljenost već označenih tekstova, ali ne prekodira rubne slučajeve drugim obranjivim pravilom."
        }
      ]
    },
    "numerical_check": {
      "applicable": false,
      "not_applicable_reason": "Zadatak traži pojmovno razdvajanje slučajnosti, fiksnoga parametra i nesigurnosti kodiranja bez brojčanog računa.",
      "expected_result": null,
      "tolerance_or_acceptance_rule": null,
      "independent_method": null,
      "evidence_reference": null
    },
    "severity_ranked_rubric": {
      "severity_order": [
        "fatal",
        "major",
        "minor",
        "useful_improvement"
      ],
      "criteria": [
        {
          "criterion_id": "fatal-assigns-confidence-to-parameter",
          "severity": "fatal",
          "description": "Odgovor razinu pouzdanosti pripisuje vjerojatnosti da fiksni parametar leži u opaženom intervalu.",
          "observable_evidence": "Središnja rečenica zadržava upravo interpretaciju koju zadatak traži isključiti."
        },
        {
          "criterion_id": "major-misses-random-fixed-or-coding-boundary",
          "severity": "major",
          "description": "Nedostaje podjela na slučajno i fiksno ili granica bootstrapiranja gotovih oznaka.",
          "observable_evidence": "Jedan od dvaju nosivih dijelova zadatka nema obrazloženje."
        },
        {
          "criterion_id": "minor-imprecise-procedure-language",
          "severity": "minor",
          "description": "Jezgra je točna, ali odgovor ne kaže da se obuhvat odnosi na usporediva ponovljena uzorkovanja pod uvjetima postupka.",
          "observable_evidence": "Potrebna je lokalna dopuna, ne promjena zaključka."
        },
        {
          "criterion_id": "useful-distinguishes-measurement-uncertainty",
          "severity": "useful_improvement",
          "description": "Odgovor dodatno razlikuje nesigurnost kodiranja od šire nesigurnosti mjerenja konstrukta.",
          "observable_evidence": "Dodatak produbljuje granicu, ali nije nužan za traženi odlomak."
        }
      ]
    }
  },
  "alternatives": [
    {
      "alternative_id": "hoop-and-post-analogy",
      "description": "Prihvatljivo je uporabiti analogiju obruča i fiksnoga kolca ako su slučajni intervali i fiksni parametar izričito imenovani.",
      "acceptance_boundary": "Analogija ne smije zamijeniti objašnjenje nesigurnosti kodiranja."
    }
  ],
  "instructor_notes": [
    "Ocjenjuje se jedna povezana argumentacija, a ne samo reproducirana definicija intervala pouzdanosti.",
    "Ne zahtijevati bayesovsku terminologiju; zadatak provjerava značenje frekventističkog postupka iz poglavlja."
  ],
  "visibility_contract": "D06-two-layer-v1",
  "human_responsibility": {
    "judgment_owner": "student_or_submitting_author",
    "verification_required": true,
    "code_production_assessed": false
  },
  "self_study": {
    "hint": "Razdvojite što se mijenja između uzoraka od onoga što ostaje fiksno. Provjerite na što se odnosi postotak pouzdanosti.",
    "worked_answer": "Slučajni su uzorak i interval koji bi novi uzorak proizveo. Kroz ponovljena uzorkovanja mijenjaju se opažanja, procjena i granice. Populacijski parametar ostaje fiksan kroz sva ponavljanja. Svaki novi interval uspoređujemo s istom vrijednošću parametra. Razina pouzdanosti opisuje dugoročni udio intervala postupka koji obuhvaćaju parametar. Nakon opažanja granica pojedini interval parametar obuhvaća ili ne obuhvaća.\n\nBootstrap gotovih oznaka ne obuhvaća nesigurnost pravila kodiranja. Ponovno uzorkovanje mijenja zastupljenost već označenih tekstova, ali ne prekodira rubne slučajeve drugim obranjivim pravilom.",
    "why_adequate": "Odgovor vezuje pouzdanost uz ponovljeni postupak te razlikuje nesigurnost uzorkovanja od nesigurnosti kodiranja. Formulacija može biti drukčija ako ostaju isti račun i obrazloženje."
  }
}
