{
  "schema_version": 1,
  "record_id": "sol-15-callout-greska-01",
  "exercise_id": "ex-15-callout-greska-01",
  "unit_id": "15",
  "source_anchor": {
    "path": "chapters/15-vise-grupa.qmd",
    "anchor": "ex-15-callout-greska-01"
  },
  "task_class": "callout_greska",
  "prompt_fingerprint": "sha256:2888134e60dfffec4835f0dfb2fb01f50973610791631163b77efd0c98285ae2",
  "answer_components": {
    "planted_error": {
      "applicable": true,
      "not_applicable_reason": null,
      "error_id": "unadjusted-pairwise-tests-treated-as-family-protected",
      "statement": "Nakon značajnog ukupnog testa svaki par možemo prosuditi na razini 0,05 bez prilagodbe, a da cijela obitelj parnih odluka ostane zaštićena na toj razini.",
      "why_wrong": "Postavka bez prilagodbe ne daje zaštitu cijele obitelji parnih odluka. Ukupni test ispituje jednakost svih sredina; njegovo odbacivanje ne govori koji se parovi razlikuju. Kad neke razlike postoje, preostale istinite jednakosti i dalje mogu biti pogrešno odbačene. Obećanje o zaštiti svake obitelji ne slijedi iz samog prethodnog ukupnog testa."
    },
    "revealing_diagnostic": {
      "applicable": true,
      "not_applicable_reason": null,
      "procedure": "Prebrojiti parove, pročitati postavku prilagodbe i provjeriti što značajni ukupni test može zaključiti o pojedinim parovima.",
      "expected_evidence": "Ukupni test i broj od deset parova ispravno su određeni. `p.adjust.method = \"none\"` ipak ne štiti cijelu obitelj parnih odluka. Značajni ukupni test govori da nisu sve sredine jednake, ali ne jamči zaštitu preostalih istinitih jednakosti kad se neki parovi doista razlikuju. Zato prolazak ukupnog testa nije dovoljan za obećanje o svakoj konfiguraciji sredina. U zadanim uvjetima možemo rabiti Tukeyjev postupak i istodobne intervale. Bez ispisa parnih rezultata još ne znamo koji se parovi razlikuju.\n\nJedna moguća zamjena glasi ovako.\n\nNakon ukupnog testa prikazat ćemo svih deset parnih razlika uz Tukeyjeve istodobne intervale i pripadne prilagođene p-vrijednosti. Iz pojedinačnih neprilagođenih testova nećemo izvoditi obećanje da je cijela obitelj odluka zaštićena na razini 0,05.\n\nPrihvatljive su i druge formulacije koje zadržavaju poduprte dijelove i obrazlažu istu granicu zaključka."
    },
    "plausible_non_answers": {
      "applicable": true,
      "not_applicable_reason": null,
      "responses": [
        {
          "response": "Pogreška je funkcija `aov`, jer se nakon nje smiju provesti samo pojedinačni t-testovi.",
          "why_insufficient": "Ukupni klasični model prikladan je za zajedničko pitanje. Problem je nezaštićena obitelj u drugom pozivu."
        },
        {
          "response": "Nema pogreške jer je svaki pojedinačni t-test valjano izračunat.",
          "why_insufficient": "Valjanost pojedinačnoga testa ne drži stopu barem jednoga lažno pozitivnog para na pet posto kroz deset odluka."
        },
        {
          "response": "Dovoljno je zadržati samo najmanju p-vrijednost.",
          "why_insufficient": "Odabir najmanje vrijednosti dodatno naglašava upravo najveću slučajnu krajnost i ne uklanja broj otvorenih prilika."
        }
      ]
    },
    "model_response_components": {
      "applicable": true,
      "not_applicable_reason": null,
      "components": [
        {
          "component_id": "preserve-overall-model",
          "required_claim": "Poziv `aov` i odabrane varijable mogu ostati korisni za klasični ukupni test.",
          "required_evidence": "Model zajednički uspoređuje svih pet sredina umjesto da svaku parnu odluku tretira kao samostalno istraživanje."
        },
        {
          "component_id": "identify-unprotected-family",
          "required_claim": "Pogrešan je zaključak da neprilagođeni parni testovi nakon značajnog ukupnog testa jamče zaštitu cijele obitelji. Postavka `p.adjust.method = \"none\"` otkriva kako su odluke donesene.",
          "required_evidence": "Broj parova iznosi 5 nad 2, odnosno 10, a nijedna prilagodba nije uključena."
        },
        {
          "component_id": "explain-individual-versus-family",
          "required_claim": "Uredna pojedinačna p-vrijednost odgovara jednom paru, ali ne vjerojatnosti barem jedne pogreške u cijelome skupu parova.",
          "required_evidence": "Nulta simulacija daje 27,4 % ponavljanja s barem jednim lažno pozitivnim parom nasuprot 4,25 % za jedan ukupni test."
        },
        {
          "component_id": "usable-repair-2026",
          "required_claim": "Nakon ukupnog testa prikazat ćemo svih deset parnih razlika uz Tukeyjeve istodobne intervale i pripadne prilagođene p-vrijednosti. Iz pojedinačnih neprilagođenih testova nećemo izvoditi obećanje da je cijela obitelj odluka zaštićena na razini 0,05.",
          "required_evidence": "Ukupni test i broj od deset parova ispravno su određeni. `p.adjust.method = \"none\"` ipak ne štiti cijelu obitelj parnih odluka. Značajni ukupni test govori da nisu sve sredine jednake, ali ne jamči zaštitu preostalih istinitih jednakosti kad se neki parovi doista razlikuju. Zato prolazak ukupnog testa nije dovoljan za obećanje o svakoj konfiguraciji sredina. U zadanim uvjetima možemo rabiti Tukeyjev postupak i istodobne intervale. Bez ispisa parnih rezultata još ne znamo koji se parovi razlikuju."
        }
      ]
    },
    "numerical_check": {
      "applicable": true,
      "not_applicable_reason": null,
      "expected_result": "Pet skupina daje 5 × 4 / 2 = 10 parova. Ranija simulacija iz poglavlja, bez uvjetovanja na prolazak ukupnog testa, daje 548/2000 = 27,4 % ponavljanja s barem jednom parnom pogreškom i 85/2000 = 4,25 % za ukupni test. Za deset neovisnih testova daje 808/2000 = 40,4 %, a teorijski 40,126306076162 %. Ti postotci nisu stopa pogreške dvostupanjskog postupka iz okvira.",
      "tolerance_or_acceptance_rule": "U ovom zadatku traži se deset parova i obrazloženje zaštite obitelji. Raniji simulacijski brojevi služe samo dodatnoj provjeri odgovarajućeg postupka; ne traže se u odgovoru na okvir.",
      "independent_method": "Izračunati kombinaciju 5 nad 2, zatim iz kanonske simulirane populacije s fiksnim strujama 1516 i 1517 zasebno ponoviti deset Welchovih parova, jedan ukupni F-test i deset neovisnih testova kroz 2000 ponavljanja; teorijsku vrijednost izračunati kao komplement deset zajedničkih neuspjeha.",
      "evidence_reference": "chapters/15-vise-grupa.qmd#ex-15-callout-greska-01"
    },
    "severity_ranked_rubric": {
      "severity_order": [
        "fatal",
        "major",
        "minor",
        "useful_improvement"
      ],
      "criteria": [
        {
          "criterion_id": "fatal-retains-unadjusted-family",
          "severity": "fatal",
          "description": "Odgovor prihvaća `none` ili pojedinačne p-vrijednosti prikazuje kao zaštitu cijele obitelji.",
          "observable_evidence": "Deset odluka i dalje se tumači na petpostotnoj pojedinačnoj razini bez imenovanoga obiteljskog postupka."
        },
        {
          "criterion_id": "major-misses-family-definition",
          "severity": "major",
          "description": "Postavka je označena kao sumnjiva, ali odgovor ne imenuje deset parova ni stopu barem jednoga lažno pozitivnog rezultata.",
          "observable_evidence": "Dijagnoza ostaje na općoj tvrdnji o korekciji bez ciljne pogreške."
        },
        {
          "criterion_id": "minor-condemns-correct-model",
          "severity": "minor",
          "description": "Središnja pogreška je pronađena, ali korisni ukupni model ili odabrane varijable pogrešno se odbacuju.",
          "observable_evidence": "Lokalna prosudba širi kritiku izvan jedinoga posađenog nedostatka."
        },
        {
          "criterion_id": "useful-adds-null-rate-check",
          "severity": "useful_improvement",
          "description": "Odgovor dodatno provjerava razliku između 27,4 % za dijeljene parove i 40,1263 % za neovisne testove.",
          "observable_evidence": "Dodatak točno ograničava domet uobičajene formule."
        }
      ]
    }
  },
  "alternatives": [
    {
      "alternative_id": "named-family-procedure",
      "description": "Prihvatljiv odgovor može kao primjer zaštite imenovati Tukeyjev postupak ili unaprijed planiranu užu obitelj, bez pisanja zamjenskoga koda.",
      "acceptance_boundary": "Mora zadržati dijagnozu `none`, imenovati deset trenutačnih parova i razlikovati pojedinačnu od obiteljske stope."
    }
  ],
  "instructor_notes": [
    "Središnja pogreška je obećanje zaštite obitelji uz neprilagođene parne testove. Sam ukupni test i izbor varijabli valjani su; račun neprilagođene p-vrijednosti nije sam po sebi računski nedostatak.",
    "Ne tražiti zamjenski kod. Ocjenjuje se statistička obitelj, dokaz i granica tvrdnje."
  ],
  "visibility_contract": "D06-two-layer-v1",
  "human_responsibility": {
    "judgment_owner": "student_or_submitting_author",
    "verification_required": true,
    "code_production_assessed": false
  }
}
